Platform,FileName,Description
NatureServe Explorer,NatureServe_logo_V.svg.png,"Get the most up-to-date, comprehensive species info."
USFWS ECOS,https://upload.wikimedia.org/wikipedia/commons/f/fb/US-FWS-logo.png,"Critical habitat, recovery plans, and ESA regulatory info."
Tennessee Wildlife Resources Agency / State Wildlife Action Plan,https://pbs.twimg.com/profile_images/1986452264643432448/oRXeTv03_400x400.jpg,"Priority wildlife species, important habitats, and statewide conservation strategies in Tennessee."
ESRI Living Atlas,images.png,"Datasets for exploring biodiversity, species ranges, and environmental patterns."
Tennessee-Kentucky Flora Atlas,Tennessee-Kentucky-Flora-Atlas,"Plant atlas showing county-level distributions, taxonomy, photos, and specimen records."
