Platform,FileName,Description
NatureServe Explorer,NatureServe_logo_V.svg.png,"Get the most up-to-date, comprehensive species info."
USFWS ECOS,Seal_of_the_United_States_Fish_and_Wildlife_Service.svg.png,"Critical habitat, recovery plans, and ESA regulatory info."
Tennessee Wildlife Resources Agency / State Wildlife Action Plan,TWRA-logo_100x100 (1).png,"Priority wildlife species, important habitats, and statewide conservation strategies in Tennessee."
ESRI Living Atlas,images.png,"Datasets for exploring biodiversity, species ranges, and environmental patterns."
Tennessee-Kentucky Flora Atlas,Tennessee-Kentucky-Flora-Atlas,"Plant atlas showing county-level distributions, taxonomy, photos, and specimen records."
